{
  "candidate_ref": "sha256:3644e886ccd710c4b5dc792ecab0f4aeeebc07c10a10f0770fe1a12f4fd28e85",
  "checks": {
    "authority_domain": true,
    "fresh": true,
    "purpose": true,
    "recipient": true,
    "schema": true,
    "scope": true,
    "slot_allowed": true,
    "unique_slot": true
  },
  "decided_at": "2026-08-15T00:00:00Z",
  "digest": "sha256:87491921d18cae5468b76321f724c61a1be1467458caef93d04047ebe3d2dd53",
  "id": "admission:quote_acme:launch_date@v1",
  "policy_revision": "policy:workspace@r1",
  "reason_codes": [
    "ALL_CHECKS_PASS"
  ],
  "verdict": "ADMIT"
}
