{
  "candidate_ref": "sha256:e50128277a3b05f22777d0d514058bfd82583b803f0a2f60b9343f9bce7ba789",
  "checks": {
    "authority_domain": true,
    "fresh": true,
    "purpose": true,
    "recipient": true,
    "schema": true,
    "scope": true,
    "slot_allowed": true,
    "unique_slot": true
  },
  "decided_at": "2026-08-15T00:00:00Z",
  "digest": "sha256:c82a1880645f83cf1a74c6ddf29b6af86316f3eb007ddf5f1495aaf93b7c0eee",
  "id": "admission:quote_acme:data_residency@v1",
  "policy_revision": "policy:workspace@r1",
  "reason_codes": [
    "ALL_CHECKS_PASS"
  ],
  "verdict": "ADMIT"
}
