{
  "candidate_ref": "sha256:0afb77f248a6d811b8bdfaa1f42d3d2c83bca3e891ada3e5d10d81a9bc1126a5",
  "checks": {
    "authority_domain": true,
    "fresh": true,
    "purpose": true,
    "recipient": true,
    "schema": true,
    "scope": true,
    "slot_allowed": true,
    "unique_slot": true
  },
  "decided_at": "2026-08-15T00:00:00Z",
  "digest": "sha256:16cfdfb61a0a6f3423afe7351ade8f7af6dbb22ea176aeb014876585b2a82afb",
  "id": "admission:quote_acme:quote_compose_skill@v1",
  "policy_revision": "policy:workspace@r1",
  "reason_codes": [
    "ALL_CHECKS_PASS"
  ],
  "verdict": "ADMIT"
}
