{
  "candidate_ref": "sha256:a881347494e3df6b95e2b1652640e6c1ef1c54fe9488efb7d7ad55ce33810d46",
  "checks": {
    "authority_domain": true,
    "fresh": true,
    "purpose": true,
    "recipient": true,
    "schema": true,
    "scope": true,
    "slot_allowed": true,
    "unique_slot": true
  },
  "decided_at": "2026-08-15T00:00:00Z",
  "digest": "sha256:71dbd2b6f950724cf4d28709f2a15c0cfbab27ca59c00a024ca0d8cebd3399e8",
  "id": "admission:quote_acme:currency@v1",
  "policy_revision": "policy:workspace@r1",
  "reason_codes": [
    "ALL_CHECKS_PASS"
  ],
  "verdict": "ADMIT"
}
